{
  "messageId": "message-id-example",
  "type": "MatchRoom",
  "version": "1.0.0",
  "occurredAt": "2026-09-08T12:00:00Z",
  "tenantId": "tenant-id-example",
  "regionId": "region-id-example",
  "clusterId": "cluster-id-example",
  "correlationId": "correlation-id-example",
  "data": {
    "gameId": "game-id-example",
    "regionId": "region-id-example",
    "clusterId": "cluster-id-example",
    "skillBucket": "example",
    "policyId": "policy-id-example"
  },
  "idempotencyKey": "idempotency-key-example"
}
